<?xml version="1.0" encoding="UTF-8"?>
<Patches xmlns:xsi="http://www.w3.org/2001/XMLSchema-instance" xsi:noNamespaceSchemaLocation="..\..\..\..\..\..\main\xsd\dbrevision.xsd">
	<Patch>
		<Name>patch-2</Name>
        <PreviousName>patch-1</PreviousName>
        <Action>
            <Type>CUSTOM_CLASS_ACTION</Type>
            <ActionParameter name="class_name">
                <Data>org.riverock.db.definition.InitWebmillStructureV2</Data>
            </ActionParameter>
        </Action>
	</Patch>
</Patches>
